key,value,comment,english
MISSION_TUTORIAL,"ファーストコンタクト","Name of the tutorial mission","First Contact"
MISSION_ABYSS,"アビス","Name of all Abyss Missions","Abyss"
MISSION_ABYSS_DEPTH,"深淵","Abyss Depth","Depth"
MISSION_EGG_HUNT,"卵探し","Mission name","Egg Hunt"
MISSION_BIG_EGG_HUNT,"巨大な卵探し","Mission name","Big Egg Hunt"
MISSION_ASTEROID_FIELD,"小惑星フィールド","Mission name","Asteroid Field"
MISSION_ARENA,"アリーナ","Mission name","Arena"
MISSION_WAVES_OF_CORRUPTION,"コラプションの波","Mission name","Waves of Corruption"
MISSION_TREASURE_HUNT,"財宝ハント","Mission name","Treasure Hunt"
MISSION_DEFEAT_KOKO,"打倒ココ","Mission name","Defeat Koko"
MISSION_THE_BIG_EGG,"巨大な卵","Mission name","The Big Egg"
MISSION_CHAMBER_OF_NIHALOR,"ニヘイラーの間","Mission name","Chamber of Nihalor"
MISSION_SURVIVE,"生存","Mission name","Survive"
MISSION_INTERLUDE,"幕間","Mission name","Interlude"
MISSION_KING_GRUVAKS_CASTLE,"グルヴァック王の城","Mission name","King Gruvak's Castle"
MISSION_LAZURITHS_HIDE,"ラズリスの隠れ家","Mission name","Lazurith's Hide"
MISSION_VETH_MARAS_LAIR,"ベスマラの巣窟","Mission name","Veth'mara's Lair"
MISSION_SEPULCHER_OF_IRON_VIGIL,"鉄のヴィジルの墓室","Mission name","Sepulcher of Iron Vigil"
MISSION_THE_LOST_OPAL,"失われたオパール","Mission name","The Lost Opal"
MISSION_TOMB_OF_VIRA,"ヴァイラの墓","Mission name","Tomb of Vira"
MISSION_CRYPT_OF_ETERNAL_VOLTRON,"永遠のヴォルトロンの地下納骨堂","Mission name","Crypt of Eternal Voltron"
MISSION_ECHOES_OF_THE_PAST,"過去の残響","Mission name","Echoes of the Past"
MISSION_TURTLE_IN_NEED,"困った亀","Mission name","Turtle in Need"
MISSION_HUNT,"狩り","Mission name","Hunt"
MISSION_HAUNTED_SECTOR,"呪われたセクター","Mission name","Haunted Sector"
MISSION_BUZZER_SPIRAL_SECTOR,"ブザースパイラルセクター","Mission name","Buzzer Spiral Sector"
MISSION_SPARKER_SPIRAL_SECTOR,"スパーカースパイラルセクター","Mission name","Sparker Spiral Sector"
MISSION_SHOCKWAVE_SECTOR,"ショックウェーブセクター","Mission name","Shockwave Sector"
MISSION_PLASMA_PURSUIT,"プラズマ追跡","Mission name","Plasma Pursuit"
MISSION_PLASMA_SECTOR,"プラズマセクター","Mission name","Plasma Sector"
MISSION_PLASMA_SPIRAL_SECTOR,"プラズマスパイラルセクター","Mission name","Plasma Spiral Sector"
MISSION_THORN_SPIRAL,"ソーンスパイラル","Mission name","Thorn Spiral"
MISSION_THORN_SECTOR,"ソーンセクター","Mission name","Thorn Sector"
MISSION_EGGS_TO_THE_NORTH,"北に卵あり","Mission name","Eggs to the North"
MISSION_GUNS_TO_THE_WEST,"西に銃あり","Mission name","Guns to the West"
MISSION_ROCKETS_TO_THE_EAST,"東にロケットあり","Mission name","Rockets to the East"
MISSION_BIG_PLASMA_BALLS,"巨大なプラズマボール","Mission name","Big Plasma Balls"
MISSION_BIG_EXPLOSIVE_ROCKETS,"巨大な爆発ロケット","Mission name","Big Explosive Rockets"
MISSION_BIG_THORNS_SECTOR,"巨大なソーンセクター","Mission name","Big Thorns Sector"
MISSION_ASTEROID_SPIRAL,"小惑星スパイラル","Mission name","Asteroid Spiral"
MISSION_WOLF_SECTOR,"ウルフセクター","Mission name","Wolf Sector"
MISSION_STAIRS_TO_THE_MOON_KING,"月王への階段","Mission name","Stairs to the Moon King"
MISSION_GUARDIANS_OF_THE_MOON_KING,"月王のガーディアン","Mission name","Guardians of the Moon King"
MISSION_TOWARDS_THE_TOMB_OF_THE_FALLEN_KNIGHT,"堕落騎士の墓へ","Mission name","Towards the Tomb of the Fallen Knight"
MISSION_BACK_TO_THE_ROOTS,"原点回帰","Mission name","Back to the Roots"
MISSION_A_LOST_EGG,"失われた卵","Mission name","A lost Egg"
MISSION_BRAMBLE_PATH,"茨の道","Mission name","Bramble Path"
MISSION_ASH_PATH,"灰の道","Mission name","Ash Path"
MISSION_RADIOACTIVE_AREA,"放射能エリア","Mission name","Radioactive Area"
MISSION_SCATTERED_AREA,"散乱エリア","Mission name","Scattered Area"
MISSION_GUARD_SPIRAL,"ガードスパイラル","Mission name","Guard Spiral"
MISSION_ELECTRIC_DEFENSE_I,"電気防御 I","Mission name","Electric Defense I"
MISSION_ELECTRIC_DEFENSE_II,"電気防御 II","Mission name","Electric Defense II"
MISSION_ELECTRIC_MADNESS_I,"電撃的狂気 I","Mission name","Electric Madness I"
MISSION_ELECTRIC_MADNESS_II,"電撃的狂気 II","Mission name","Electric Madness II"
MISSION_ELECTRIC_MADNESS_III,"電撃的狂気 III","Mission name","Electric Madness III"
MISSION_CREDITS,"失われた通信","Mission name","Lost Transmission"
MISSION_DESTROY_ALL_ENEMIES_OBJECTIVE,"全ての敵を破壊する","Objective","Destroy all Enemies"
MISSION_DEFEAT_BOSS_OBJECTIVE,"{0}を倒す","Objective","Defeat {0}"
MISSION_DEFEAT_BOSS_OBJECTIVE_ONCE_AND_FOR_ALL,"{0}を倒して決着をつける","Objective, {0}=boss name","Defeat {0} - Once and for all"
MISSION_DEFEAT_BOSSES_OBJECTIVE,"{0}体のボスを倒す","Objective, {0}=amount","Defeat {0} Bosses"
MISSION_DESTROY_ENEMY_SPIRAL_OBJECTIVE,"敵のスパイラルを破壊する","Objective","Destroy the Enemy Spiral"
MISSION_DESTROY_ENEMY_WAVES_OBJECTIVE,"敵の波を{0}回破壊する","Objective, {0}=amount","Destroy {0} Enemy Waves"
MISSION_FIND_TURTLE_EGGS_OBJECTIVE_ONE,"亀の卵を{0}個見つける","Objective, {0}=amount-singular","Find {0} Turtle Egg"
MISSION_FIND_TURTLE_EGGS_OBJECTIVE_MANY,"亀の卵を{0}個見つける","Objective, {0}=amount-plural","Find {0} Turtle Eggs"
MISSION_RESCUE_TURTLE_OBJECTIVE,"全ての敵を破壊し、商人亀を救出する","Objective","Destroy all enemies and rescue the Trader Turtle"
MISSION_SURVIVE_OBJECTIVE,"{0}秒間生存する","Objective, {0}=x seconds","Survive {0}"
MISSION_UNLOCK_STASH_OBJECTIVE,"全ての敵を破壊し、スタッシュを回収する","Objective","Destroy all enemies and salvage your Stash"
MISSION_NIHALOR_CHAMBER_OBJECTIVE,"広間へ降下する","Objective","Descend into the Chamber"
MISSION_KIKI_FALLEN_KNIGHT_OBJECTIVE,"キキを手伝い、堕落騎士の墓をレイドする","Objective","Help Kiki to raid the Tomb of the Fallen Knight"
MISSION_KIKI_INVESTIGATION_OBJECTIVE,"子狐が何を企んでいるか調査する","Objective","Investigate what the little fox is up to"
MISSION_KIKI_RAID_SEPULCHER_OBJECTIVE,"キキを手伝い、墓室をレイドする","Objective","Help Kiki to raid the Sepulcher"
MISSION_KIKI_LOST_OPAL_OBJECTIVE,"キキを手伝い、失われたオパールを入手する","Objective","Help Kiki to loot the Lost Opal"
MISSION_HELP_KIKI_OBJECTIVE,"キキを手伝う","Objective","Help Kiki"
MISSION_HELP_KIKI_TO_RAID_THE_CRYPT_OBJECTIVE,"キキを手伝い、地下納骨堂をレイドする","Objective","Help Kiki to raid the Crypt"
MISSION_KIKI_RAID_TOMB_OF_ETERNAL_QUEEN_OBJECTIVE,"キキを手伝い、永遠の女王の墓をレイドする","Objective","Help Kiki to raid the Tomb of the Eternal Queen"
MISSION_TALK_TO_CARLO_OBJECTIVE,"カルロと話す","Objective","Talk to Carlo"
MISSION_TALK_TO_KIKI_OBJECTIVE,"キキと話す","Objective","Talk to Kiki"
MISSION_TALK_TO_KIKI_AND_CARLO_OBJECTIVE,"キキとカルロと話す","Objective","Talk to Kiki and Carlo"
MISSION_TALK_TO_KING_GRUVAK_OBJECTIVE,"グルヴァック王と話す","Objective","Talk to King Gruvak"
MISSION_TALK_TO_LAZURITH_OBJECTIVE,"ラズリスと話す","Objective","Talk to Lazurith"
MISSION_TALK_TO_VETH_MARA_OBJECTIVE,"ベスマラと話す","Objective","Talk to Veth'mara"
MISSION_CLAIM_BACK_MANUAL_OBJECTIVE,"自分のものを取り戻す","Objective","Claim back what is yours"
MISSION_INVESTIGATE_BIG_EGG_OBJECTIVE,"巨大な卵を調査する","Objective","Investigate the Big Egg"
MISSION_INVESTIGATE_EGG_RIFT_OBJECTIVE,"エッグリフトを調査する","Objective","Investigate the Egg Rift"
MISSION_ENEMIES_REMAINING_ONE,"敵の残数：{0}体","{0}=number, singular","{0} Enemy remaining"
MISSION_ENEMIES_REMAINING_MANY,"敵の残数：{0}体","{0}=number, plural","{0} Enemies remaining"
MISSION_BOSSES_REMAINING_ONE,"ボスの残数：{0}体","{0}=number, singular","{0} Boss remaining"
MISSION_BOSSES_REMAINING_MANY,"ボスの残数：{0}体","{0}=number, plural","{0} Bosses remaining"
MISSION_EGGS_REMAINING_ONE,"卵の残数：{0}個","{0}=number, singular","{0} Egg remaining"
MISSION_EGGS_REMAINING_MANY,"卵の残数：{0}個","{0}=number, plural","{0} Eggs remaining"
MISSION_GET_READY_COUNTDOWN,"開始まで：{0}","{0}=seconds","Get ready: {0}"
MISSION_SURVIVAL_COUNTDOWN,"残り時間：{0}","{0}=seconds","{0} remaining"
MISSION_CREDITS_OBJECTIVE,"Astrolootチームからの通信","","A transmission from the Astroloot Team"
MISSION_FREE_KIKI_OBJECTIVE,"キキを解放する","Objective","Free Kiki"
MISSION_FIND_NEXUS_SHARDS_OBJECTIVE_ONE,"ネクサスシャードを{0}個見つける","Objective, {0}=amount-singular","Find {0} Nexus Shard"
MISSION_FIND_NEXUS_SHARDS_OBJECTIVE_MANY,"ネクサスシャードを{0}個見つける","Objective, {0}=amount-plural","Find {0} Nexus Shards"
MISSION_SHARDS_REMAINING_ONE,"シャードの残数：{0}個","{0}=number, singular","{0} Shard remaining"
MISSION_SHARDS_REMAINING_MANY,"シャードの残数：{0}個","{0}=number, plural","{0} Shards remaining"
MISSION_RACE_OBJECTIVE_ROUND,"ラウンド{0}/{1}","{0, 1}=number, e.g. Round 1/3","Round {0}/{1}"
MISSION_RACE_OBJECTIVE_WIN,"レースに勝利する","","Win the Race"
MISSION_CREDITS_DEVELOPMENT,"開発","","Development"
MISSION_CREDITS_GAME_DESIGN,"ゲームデザイン","","Game Design"
MISSION_CREDITS_UX_AND_STORY,"UX＆ストーリー","","UX and Story"
MISSION_CREDITS_ADDITIONAL_ARTWORK,"追加アートワーク","","Additional Artwork"
MISSION_CREDITS_LOCALIZATION,"ローカライゼーション","","Localization"
MISSION_CREDITS_UNIQUE_ITEM_DESIGNERS,"ユニークアイテムデザイナー","","Unique item designers"
MISSION_CREDITS_SOUND_AND_MUSIC,"サウンド＆ミュージック","","Sound & Music"
MISSION_CREDITS_LIBRARIES,"Powered by","","Powered by"
MISSION_CREDITS_LAST_BUT_NOT_LEAST,"そして最後に","","Last but not least"
MISSION_CREDITS_THANK_YOU_FOR_PLAYING,"プレイしていただき、ありがとうございました！","","Thank YOU for playing!"
MISSION_NPC_KIKI,"キキ","NPC name in dialog","Kiki"
MISSION_NPC_KIKI_THE_REAL_ONE,"キキ（本物）","NPC name in dialog","Kiki (the real one)"
MISSION_NPC_KOKO,"ココ","NPC name in dialog","Koko"
MISSION_NPC_WULFRIC,"ウルフリック","NPC name in dialog","Wulfric"
MISSION_NPC_MOON_KING,"月王","NPC name in dialog","The Moon King"
MISSION_NPC_CARLO,"カルロ","NPC name in dialog","Carlo"
MISSION_NPC_KING_GRUVAK,"グルヴァック王","NPC name in dialog","King Gruvak"
MISSION_NPC_VETH_MARA,"ベスマラ","NPC name in dialog","Veth'mara"
MISSION_NPC_LAZURITH,"ラズリス","NPC name in dialog","Lazurith"
MISSION_CARLO_DIALOG_RESCUE_1,"ああ、助かった！もう何日もここで立往生していたんだ。","Dialog","Oh, thank the stars! I've been stranded here for days."
MISSION_CARLO_DIALOG_RESCUE_2,"あのハウンターたちのせいで身動きが取れない。迂闊に動けなくてね。","Dialog","Those Haunters have me on the hook. I don't dare to move."
MISSION_CARLO_DIALOG_RESCUE_3,"助けてくれたら、ショップが復旧次第、好きなものを選ばせてやろう。","Dialog","Help me out, and you'll get first pick once my shop's back online."
MISSION_CARLO_DIALOG_GIANT_EGG_START_1,"セクターのこんな深くまで来ると、奇妙なことが起こるもんだ...","Dialog","Things are getting strange this deep into the sector..."
MISSION_CARLO_DIALOG_GIANT_EGG_START_2,"わかるんだ...盗まれた私の卵が近くにあるに違いない。","Dialog","I can feel it - my stolen eggs must be nearby."
MISSION_CARLO_DIALOG_GIANT_EGG_START_3,"君の助けがあれば、きっと全部見つけ出せるはずだ。","Dialog","With your help, I know we will find every last one."
MISSION_CARLO_DIALOG_GIANT_EGG_START_4,"そうだ、噂によれば...この辺りのどこかに巨大な卵があるらしい。とてつもなく巨大な卵がね。","Dialog","Oh, and rumor has it... there's a giant egg somewhere out here. A very giant egg."
MISSION_KIKI_DIALOG_PINK_DIAMOND_START_1,"ねえ！そこの君！そう、君よ！","Dialog","Pssst! You! Yes, you!"
MISSION_KIKI_DIALOG_PINK_DIAMOND_START_2,"信じられないようなことを聞き出したの！","Dialog","You're not gonna believe what I just sniffed out!"
MISSION_KIKI_DIALOG_PINK_DIAMOND_START_3,"このセクターで一番伝説的で、一番まばゆくて、一番ピンクな財宝...","Dialog","Only the most legendary, most dazzling, most pink treasure in the entire sector!"
MISSION_KIKI_DIALOG_PINK_DIAMOND_START_4,"ピンクのダイヤモンドの話よ！","Dialog","The Pink Diamond!"
MISSION_KIKI_DIALOG_PINK_DIAMOND_START_5,"本物なの。ニヘイラーの不気味で年老いたガーディアンの最後の生き残りが溜め込んでるらしいわ。","Dialog","It's real, and it's being hoarded by the last of Nihalor's creepy old Guardians."
MISSION_KIKI_DIALOG_PINK_DIAMOND_START_6,"君が悪者を撃って、私がお宝をいただく。昔みたいにね！","Dialog","You shoot the bad things, I grab the treasure. Just like old times!"
MISSION_CARLO_DIALOG_GOLDEN_EGG_START_1,"これまで、セクターのここまで深部に来た者は誰もいない。","Dialog","No one has ever ventured this deep into the sector."
MISSION_CARLO_DIALOG_GOLDEN_EGG_START_2,"右の道はドラクベスに通じている。","Dialog","The path to the right leads to Drak'Veth."
MISSION_CARLO_DIALOG_GOLDEN_EGG_START_3,"昔、私からとてつもなく価値のあるものを奪った盗人だ。","Dialog","A thief, who stole something of great worth from me long ago."
MISSION_CARLO_DIALOG_GOLDEN_EGG_START_4,"私一人では、彼に太刀打ちできない。取り戻すのを手伝ってくれないか？","Dialog","Alone, I stand no chance against him. Will you help me get it back?"
MISSION_KIKI_DIALOG_LOST_OPAL_START_1,"まっすぐ進んだ先には、グルヴァック王の巣窟があるわ。","Dialog","Straight ahead lies the lair of King Gruvak."
MISSION_KIKI_DIALOG_LOST_OPAL_START_2,"君にはまだ手に負えないかもしれないわね。","Dialog","I'm not sure you're ready for that kind of challenge just yet."
MISSION_KIKI_DIALOG_LOST_OPAL_START_3,"左の道は失われたオパールに通じてるわ。私、あれをどうしても手に入れたいの。","Dialog","The path to the left leads to the Lost Opal, which I desperately need to have."
MISSION_KIKI_DIALOG_LOST_OPAL_START_4,"もう一度、私と一緒にサイドクエストでルートしたいなら、ついてきて！","Dialog","Join me, if you want to loot with me on a side quest once more!"
MISSION_KING_GRUVAK_DIALOG_1,"ほう、たいしたものだ。","Dialog","Well. Look at you."
MISSION_KING_GRUVAK_DIALOG_2,"あの狂犬とそのノミだらけの子犬を片付けたからといって、自分が特別だとでも思っているのか？","Dialog","You think you're special because you scrapped that deranged mutt and his flea-bitten pup?"
MISSION_KING_GRUVAK_DIALOG_3,"我が玉座は、お前のような墜落した船千隻のコアから鍛えられたものだ。","Dialog","My throne is forged from the cores of a thousand fallen ships like yours."
MISSION_KING_GRUVAK_DIALOG_4,"来い。ニヘイラーに代わって、お前を殺してやろう。","Dialog","Come, and on behalf of Nihalor, I will end you."
MISSION_LAZURITH_DIALOG_1,"そうか...最後の挑戦者が現れたか。","Dialog","So... the final challenger arrives."
MISSION_LAZURITH_DIALOG_2,"お前が来るだろうと、星々から聞いていた。","Dialog","The stars whispered you would come."
MISSION_LAZURITH_DIALOG_3,"最後に誓いを立てたのは私だった。栄光のためではない...","Dialog","I was the last to swear the oath. Not for glory..."
MISSION_LAZURITH_DIALOG_4,"...ニヘイラーを目覚めさせないためだ。","Dialog","...but to keep Nihalor sleeping."
MISSION_LAZURITH_DIALOG_5,"必要とあらば、真の一撃を放て。だが、これだけは覚えておけ。","Dialog","Strike true, if you must. But know this:"
MISSION_LAZURITH_DIALOG_6,"私が倒れる時...ニヘイラーが目覚める。","Dialog","When I fall... Nihalor awakens."
MISSION_VETH_MARA_DIALOG_1,"お前は私の子供たちを捻り潰した...あの子たちが糧を得る前に、その未来を打ち砕いたのだ。","Dialog","You crushed my spawnlings - shattered their promise before they could feed."
MISSION_VETH_MARA_DIALOG_2,"だが、お前のことは覚えている。鈍くて、親切を装ったお節介焼きだ。","Dialog","But I remember you. The slow one. The meddler cloaked in kindness."
MISSION_VETH_MARA_DIALOG_3,"カルロ...巣に戻ってくるべきではなかったな。","Dialog","Carlo... you should never have come back to the nest."
MISSION_VETH_MARA_DIALOG_4,"私こそ最初の胎。古代の腐敗。言葉の母。","Dialog","I am the first womb. The ancient rot. The mother of mouths."
MISSION_VETH_MARA_DIALOG_5,"そしてお前たちは...柔らかく、温かい。喜んで私の喉を滑り落ちるがいい。","Dialog","And you... you soft, warm things. You will slide down my throats gladly."
MISSION_KIKI_RESCUE_DIALOG_1,"光よ！懐かしい顔！待って...あなた！そんな...","Dialog","Light! A friendly face! Wait... you! Oh no."
MISSION_KIKI_RESCUE_DIALOG_2,"あれは私じゃないわ。ココよ——私の邪悪な双子の姉！","Dialog","That wasn't me. That was Koko - my evil twin sister!"
MISSION_KIKI_RESCUE_DIALOG_3,"気づかなかったの？眼帯や、その下にある狂った目に？","Dialog","You didn't notice? The eye-patch? The mad eye underneath it?"
MISSION_KIKI_RESCUE_DIALOG_4,"勘弁してよ！あんなにひどく時代遅れなものを私が着るわけないでしょ。","Dialog","I mean, come on! I'd never wear something so hideously out of fashion."
MISSION_KIKI_RESCUE_DIALOG_5,"最初、あの子はピンクのダイヤモンドを欲しがってたわ。もちろんね。でもその後...","Dialog","At first she wanted the Pink Diamond. Of course she did. But then..."
MISSION_KIKI_RESCUE_DIALOG_6,"あなたのクラフトマニュアルを見たの。それで全てが変わったわ。","Dialog","She saw your crafting manual. And that changed everything."
MISSION_KIKI_RESCUE_DIALOG_7,"あの子はこう言った...一字一句そのままよ。「欲しいものを何でも作れるなら、どうしてピカピカの石ころ1つに時間を無駄にしなきゃいけないの？」ってね。","Dialog","She said, and I quote - 'Why waste time on one shiny rock when I can make anything I want?'"
MISSION_KIKI_RESCUE_DIALOG_8,"だからあの子は私をポッドに置き去りにして、あなたのマニュアルをひったくって逃げたの。","Dialog","So she ditched me in that pod, grabbed your manual, and ran."
MISSION_KIKI_RESCUE_DIALOG_9,"あの子はそれを使って、キラキラしたくだらないものを作ろうとするでしょうね。そのせいで、きっと惑星の半分を爆発させてしまう。","Dialog","She'll try to use it for shiny and stupid and probably explode half a planet doing it."
MISSION_KIKI_RESCUE_DIALOG_10,"あの子を止めないと。あなたのマニュアルが、キラキラ光るドゥームキャノンに変わってしまう前に。","Dialog","We have to stop her. Before she turns your manual into a glitter cannon of doom."
MISSION_KIKI_WARM_UP_DIALOG_1,"ちょっとしたウォーミングアップはどう？","Dialog","How about a tiny warm-up?"
MISSION_KIKI_WARM_UP_DIALOG_2,"セクターのこの辺りね？古代の財宝で埋め尽くされてるわ。","Dialog","This part of the sector? Buried in ancient treasures."
MISSION_KIKI_WARM_UP_DIALOG_3,"ガラクタかもしれないし、ピカピカかもしれないし、呪われてるかもしれない。ワクワクするでしょ？","Dialog","Could be junk. Could be shiny. Could be cursed. Isn't that exciting!?"
MISSION_KIKI_LOOT_BOX_DIALOG_1,"何を見つけたと思う？またあのピカピカで、施錠されたルートボックスよ！","Dialog","Guess what I found! Another one of those shiny, locked-up Loot Boxes!"
MISSION_KIKI_LOOT_BOX_DIALOG_2,"クレジットも、マイクロトランザクションも不要。「期間限定オファー」のポップアップもなし！","Dialog","No credits needed. No microtransactions. No 'limited-time offer' popups!"
MISSION_KIKI_LOOT_BOX_DIALOG_3,"これこそが本物のルートよ。手に入れる唯一の方法は、私と一緒に財宝探しに来ること！","Dialog","This is the real loot. Only way to get one is to come treasure-hunting with me!"
MISSION_KIKI_LOOT_BOX_DIALOG_4,"準備はいい？行くわよ～！","Dialog","Ready? Let's goooo!"
MISSION_NIHALOR_CHAMBER_DIALOG_1,"四人衆は静かに見張りに立った。四人衆は永遠のヴィジルの重みを背負った。","Dialog","Four stood watch in silence. Four bore the weight of eternal vigil."
MISSION_NIHALOR_CHAMBER_DIALOG_2,"ムーニー...グルヴァック...ベスマラ...ラズリス...","Dialog","Moony... Gruvak... Veth'mara... Lazurith..."
MISSION_NIHALOR_CHAMBER_DIALOG_3,"彼らの力がお前の中に流れ込み、初めてニヘイラーの封印は破られるだろう。","Dialog","Their strength must flow through you. Only then shall Nihalor's seal break."
MISSION_NIHALOR_CHAMBER_DIALOG_4,"降臨せよ、全ての恩恵を受ける者よ。さもなくば、消え去るがいい。","Dialog","Descend, bearer of all boons - or be unmade."
MISSION_KIKI_GEAR_TREASURE_HUNT_START_1,"あら、こんなものを見つけちゃったわ！","Dialog","Well, look what I stumbled upon!"
MISSION_KIKI_GEAR_TREASURE_HUNT_START_2,"新しい一連の墓よ！まさに探検してくれって言ってるみたい！","Dialog","Another set of tombs just begging to be explored!"
MISSION_KIKI_GEAR_TREASURE_HUNT_START_3,"見つけた装備は全部あなたのものよ。私？私はキラキラしたものがあればそれでいいわ！","Dialog","You can keep all gear we find. Me? I'm just here for the sparkles!"
MISSION_KIKI_GEAR_TREASURE_HUNT_END_1,"あら、堕落騎士の墓を発見してしまったわね！","Dialog","Huh, we found the Tomb of the Fallen Knight!"
MISSION_KIKI_GEAR_TREASURE_HUNT_END_2,"噂によると、その騎士はかなり強力な武器と一緒に埋葬されたらしいわ。","Dialog","Rumor has it, the Knight was buried with a pretty powerful weapon."
MISSION_KIKI_GEAR_TREASURE_HUNT_END_3,"今頃はもうくすんでホコリまみれだろうから、あなたにあげるわ。","Dialog","I'm sure it's dull and dusty by now, so you should take it."
MISSION_KIKI_IRON_VIGIL_DIALOG_1,"気をつけて。この場所を守っているのはとんでもない連中よ。","Dialog","Watch out - there are some absolute madlads guarding this place."
MISSION_KIKI_IRON_VIGIL_DIALOG_2,"あなたがこのミッションの相棒で運がよかったわ。準備はいい？","Dialog","I'm lucky to have you as my sidekick for this mission. Ready?"
MISSION_KIKI_LOST_OPAL_DIALOG_1_1,"うーん...この場所、なんだか変な感じね...ものすごく奇妙だわ。","Dialog","Hmm... this place feels kinda weird... Like, extra weird."
MISSION_KIKI_LOST_OPAL_DIALOG_1_2,"コラプト状態エリアに長居しちゃダメよ、わかった？","Dialog","Don't stay in the corrupted area too long, okay?"
MISSION_KIKI_LOST_OPAL_DIALOG_2_1,"マズいわね...財宝がコラプト状態エリアのもっと奥に移動しちゃったみたいだわ！","Dialog","Uh-oh... it looks like the treasure moved even deeper into the corrupted area!"
MISSION_KIKI_LOST_OPAL_DIALOG_2_2,"くれぐれも慎重にね！","Dialog","Be super duper careful!"
MISSION_KIKI_LOST_OPAL_DIALOG_3_1,"ピカピカのものが、ヤバい領域のずーっと奥に隠れちゃってるみたい。","Dialog","Looks like the shiny stuff is hiding way inside the bad zone now."
MISSION_KIKI_LOST_OPAL_DIALOG_3_2,"どうして私の財宝は、いつも入手しづらいのかしら？","Dialog","Why do my treasures always have to be that hard to get?"
MISSION_KIKI_LOST_OPAL_DIALOG_4_1,"うわあ...失われたオパール。すっごく輝いていて、すっごく危険。でも、それだけの価値は絶対あるわ！","Dialog","Whoa… the Lost Opal. So shiny. So dangerous. So totally worth it!"
MISSION_KIKI_LOST_OPAL_DIALOG_4_2,"コラプションにやられる前に、手に入れるわよ！","Dialog","Let's grab it before the corruption does!"
MISSION_KIKI_TREASURE_HUNT_START_DIALOG_1,"ねえ、あなた。やりごたえのある挑戦なら任せてって雰囲気ね！","Dialog","Hey, you look like someone who can handle a challenge!"
MISSION_KIKI_TREASURE_HUNT_START_DIALOG_2,"この小惑星の墓に隠された古代の財宝を見つけたの。","Dialog","I've found an ancient treasure hidden in this asteroid tomb."
MISSION_KIKI_TREASURE_HUNT_START_DIALOG_3,"でも墓は呪われていて...何と言うか、「あんまり友好的じゃない生き物たち」に守られてるの。","Dialog","But it's cursed and guarded by some... let's just say, not-so-friendly creatures."
MISSION_KIKI_TREASURE_HUNT_START_DIALOG_4,"このレイドにパートナーが必要なのよ。\nどうかしら？","Dialog","I could use a partner in this raid.\nAre you in?"
